{
  "schema_version": "cloud80-gold-standard-v1",
  "gold_id": "cloud80-20260803-v1",
  "created_at": "2026-08-09T21:40:00Z",
  "question_fixture": {
    "path": "eval/online_subset_20260803.json",
    "sha256": "7f9cc4c2470f6aa5dcfef6d928429e6b08fb73453d592e3a188d913128e85e2d",
    "question_count": 80,
    "question_ids_sha256": "caf7768c16dfca66484b62012b225fb5c67fc62be5ee89a145ffb4123b2ef7af"
  },
  "review_policy": {
    "status": "pending",
    "required_reviewer_type": "human",
    "decision_schema_version": "cloud80-gold-approval-decision-v1",
    "signature_identity": "cloud80-gold-approver",
    "signature_namespace": "cloud80-gold-standard-approval-v1"
  },
  "cases": [
    {
      "id": "reg_01",
      "question": "CCAR-92部对无人机飞行空域有哪些具体要求？",
      "review_status": "pending",
      "reviewer_type": null,
      "reviewed_by": null,
      "reviewed_at": null,
      "answer_contract": null,
      "blockers": [
        "human_review_missing",
        "answer_contract_missing",
        "authority_binding_missing"
      ]
    },
    {
      "id": "reg_02",
      "question": "民用无人机驾驶员合格证和执照有什么区别？",
      "review_status": "pending",
      "reviewer_type": null,
      "reviewed_by": null,
      "reviewed_at": null,
      "answer_contract": null,
      "blockers": [
        "human_review_missing",
        "answer_contract_missing",
        "authority_binding_missing"
      ]
    },
    {
      "id": "reg_03",
      "question": "无人机中空飞行的高度范围是多少米？",
      "review_status": "pending",
      "reviewer_type": null,
      "reviewed_by": null,
      "reviewed_at": null,
      "answer_contract": null,
      "blockers": [
        "human_review_missing",
        "answer_contract_missing",
        "authority_binding_missing"
      ]
    },
    {
      "id": "reg_04",
      "question": "无人机信号失联后的标准处置流程是什么？",
      "review_status": "pending",
      "reviewer_type": null,
      "reviewed_by": null,
      "reviewed_at": null,
      "answer_contract": null,
      "blockers": [
        "human_review_missing",
        "answer_contract_missing",
        "authority_binding_missing"
      ]
    },
    {
      "id": "reg_05",
      "question": "风切变对无人机有什么危害，如何应对？",
      "review_status": "pending",
      "reviewer_type": null,
      "reviewed_by": null,
      "reviewed_at": null,
      "answer_contract": null,
      "blockers": [
        "human_review_missing",
        "answer_contract_missing",
        "authority_binding_missing"
      ]
    },
    {
      "id": "reg_06",
      "question": "操控员训练机构对训练场地面积和设施有哪些要求？",
      "review_status": "pending",
      "reviewer_type": null,
      "reviewed_by": null,
      "reviewed_at": null,
      "answer_contract": null,
      "blockers": [
        "human_review_missing",
        "answer_contract_missing",
        "authority_binding_missing"
      ]
    },
    {
      "id": "reg_07",
      "question": "民用无人驾驶航空器实名登记需要准备哪些材料？",
      "review_status": "pending",
      "reviewer_type": null,
      "reviewed_by": null,
      "reviewed_at": null,
      "answer_contract": null,
      "blockers": [
        "human_review_missing",
        "answer_contract_missing",
        "authority_binding_missing"
      ]
    },
    {
      "id": "reg_09",
      "question": "低空空域管理和无人机运行之间有什么关系？",
      "review_status": "pending",
      "reviewer_type": null,
      "reviewed_by": null,
      "reviewed_at": null,
      "answer_contract": null,
      "blockers": [
        "human_review_missing",
        "answer_contract_missing",
        "authority_binding_missing"
      ]
    },
    {
      "id": "reg_10",
      "question": "无人机夜间飞行需要满足什么特殊条件？",
      "review_status": "pending",
      "reviewer_type": null,
      "reviewed_by": null,
      "reviewed_at": null,
      "answer_contract": null,
      "blockers": [
        "human_review_missing",
        "answer_contract_missing",
        "authority_binding_missing"
      ]
    },
    {
      "id": "reg_11",
      "question": "CCAR-92部对无人机操控员执照有什么要求？",
      "review_status": "pending",
      "reviewer_type": null,
      "reviewed_by": null,
      "reviewed_at": null,
      "answer_contract": null,
      "blockers": [
        "human_review_missing",
        "answer_contract_missing",
        "authority_binding_missing"
      ]
    },
    {
      "id": "reg_12",
      "question": "无人机驾驶员执照等级如何划分？",
      "review_status": "pending",
      "reviewer_type": null,
      "reviewed_by": null,
      "reviewed_at": null,
      "answer_contract": null,
      "blockers": [
        "human_review_missing",
        "answer_contract_missing",
        "authority_binding_missing"
      ]
    },
    {
      "id": "reg_13",
      "question": "无人驾驶航空器实名登记和登记管理有哪些要求？",
      "review_status": "pending",
      "reviewer_type": null,
      "reviewed_by": null,
      "reviewed_at": null,
      "answer_contract": null,
      "blockers": [
        "human_review_missing",
        "answer_contract_missing",
        "authority_binding_missing"
      ]
    },
    {
      "id": "reg_15",
      "question": "无人机飞行需要遵守哪些基本法律法规？",
      "review_status": "pending",
      "reviewer_type": null,
      "reviewed_by": null,
      "reviewed_at": null,
      "answer_contract": null,
      "blockers": [
        "human_review_missing",
        "answer_contract_missing",
        "authority_binding_missing"
      ]
    },
    {
      "id": "flt_01",
      "question": "无人机起飞前标准检查清单包含哪些项目？",
      "review_status": "pending",
      "reviewer_type": null,
      "reviewed_by": null,
      "reviewed_at": null,
      "answer_contract": null,
      "blockers": [
        "human_review_missing",
        "answer_contract_missing",
        "authority_binding_missing"
      ]
    },
    {
      "id": "flt_02",
      "question": "为什么逆风起飞比顺风起飞更安全？",
      "review_status": "pending",
      "reviewer_type": null,
      "reviewed_by": null,
      "reviewed_at": null,
      "answer_contract": null,
      "blockers": [
        "human_review_missing",
        "answer_contract_missing",
        "authority_binding_missing"
      ]
    },
    {
      "id": "flt_03",
      "question": "无人机侧风起降的操作要领是什么？",
      "review_status": "pending",
      "reviewer_type": null,
      "reviewed_by": null,
      "reviewed_at": null,
      "answer_contract": null,
      "blockers": [
        "human_review_missing",
        "answer_contract_missing",
        "authority_binding_missing"
      ]
    },
    {
      "id": "flt_04",
      "question": "云层高度和能见度会如何影响无人机飞行安全？",
      "review_status": "pending",
      "reviewer_type": null,
      "reviewed_by": null,
      "reviewed_at": null,
      "answer_contract": null,
      "blockers": [
        "human_review_missing",
        "answer_contract_missing",
        "authority_binding_missing"
      ]
    },
    {
      "id": "flt_05",
      "question": "无人机应急返航时需要注意哪些风险？",
      "review_status": "pending",
      "reviewer_type": null,
      "reviewed_by": null,
      "reviewed_at": null,
      "answer_contract": null,
      "blockers": [
        "human_review_missing",
        "answer_contract_missing",
        "authority_binding_missing"
      ]
    },
    {
      "id": "flt_06",
      "question": "无人机任务规划主要包括哪些步骤和要素？",
      "review_status": "pending",
      "reviewer_type": null,
      "reviewed_by": null,
      "reviewed_at": null,
      "answer_contract": null,
      "blockers": [
        "human_review_missing",
        "answer_contract_missing",
        "authority_binding_missing"
      ]
    },
    {
      "id": "flt_07",
      "question": "无人机空中交通管制的基本原则和流程是什么？",
      "review_status": "pending",
      "reviewer_type": null,
      "reviewed_by": null,
      "reviewed_at": null,
      "answer_contract": null,
      "blockers": [
        "human_review_missing",
        "answer_contract_missing",
        "authority_binding_missing"
      ]
    },
    {
      "id": "flt_08",
      "question": "超视距飞行运行需要满足哪些安全和规范要求？",
      "review_status": "pending",
      "reviewer_type": null,
      "reviewed_by": null,
      "reviewed_at": null,
      "answer_contract": null,
      "blockers": [
        "human_review_missing",
        "answer_contract_missing",
        "authority_binding_missing"
      ]
    },
    {
      "id": "flt_09",
      "question": "GPS信号丢失时无人机应该采取什么操作措施？",
      "review_status": "pending",
      "reviewer_type": null,
      "reviewed_by": null,
      "reviewed_at": null,
      "answer_contract": null,
      "blockers": [
        "human_review_missing",
        "answer_contract_missing",
        "authority_binding_missing"
      ]
    },
    {
      "id": "flt_10",
      "question": "多旋翼无人机悬停时如何进行姿态稳定控制？",
      "review_status": "pending",
      "reviewer_type": null,
      "reviewed_by": null,
      "reviewed_at": null,
      "answer_contract": null,
      "blockers": [
        "human_review_missing",
        "answer_contract_missing",
        "authority_binding_missing"
      ]
    },
    {
      "id": "flt_11",
      "question": "无人机雨天飞行有哪些风险和注意事项？",
      "review_status": "pending",
      "reviewer_type": null,
      "reviewed_by": null,
      "reviewed_at": null,
      "answer_contract": null,
      "blockers": [
        "human_review_missing",
        "answer_contract_missing",
        "authority_binding_missing"
      ]
    },
    {
      "id": "flt_12",
      "question": "雷暴天气下无人机飞行有什么危险？",
      "review_status": "pending",
      "reviewer_type": null,
      "reviewed_by": null,
      "reviewed_at": null,
      "answer_contract": null,
      "blockers": [
        "human_review_missing",
        "answer_contract_missing",
        "authority_binding_missing"
      ]
    },
    {
      "id": "flt_13",
      "question": "无人机禁飞区有哪些类型，如何避免误入？",
      "review_status": "pending",
      "reviewer_type": null,
      "reviewed_by": null,
      "reviewed_at": null,
      "answer_contract": null,
      "blockers": [
        "human_review_missing",
        "answer_contract_missing",
        "authority_binding_missing"
      ]
    },
    {
      "id": "flt_14",
      "question": "无人机发生安全事故后如何报告和处理？",